{
  "$schema": "../world.schema.json",
  "format": "situation-v1",
  "schemaVersion": 2,
  "rulesVersion": "srd-5.1-table-2",
  "revision": 1,
  "order": 0,
  "id": "moonbridge-conspiracy",
  "title": "月桥镇：被偷走的月光",
  "subtitle": "八处地点，一座会回应你的河谷小镇",
  "description": "镇上的暖炉突然亮得耀眼，河上的月灯却一盏盏熄灭。你可以先救渡船居民、追查失踪的账本，或寻找旧神龛与观测站的联系。人们各有难处；你选择怎样介入，也选择最后要保护什么。冒险会保存地点、线索、承诺和已发生的事，可以分次继续。",
  "minutes": "3–5 次游玩 · 时长随选择变化",
  "theme": "河谷谜案 · 救援 · 身份疑云",
  "difficulty": "一级角色 · 先说明风险再行动",
  "hook": "你推开月桥旅店的门，湿冷的河风追进来。炉边，一个浑身沾着银色粉末的年轻人握着空茶杯。她说，昨夜采石场开了新泵，镇上的暖炉从此不缺火；可渡船的引航灯全灭了。店主把一张镇图摊在桌上：档案库、集市、渡口和旧神龛都还开着门。你想先问谁，或先去哪里？",
  "locations": [
    {
      "id": "inn",
      "title": "月桥旅店",
      "description": "河谷的旅人把湿斗篷挂在同一条木架上。炉火暖得反常，门外的河灯却越来越暗。店主保留着旧镇歌，年轻采石工梅拉正担心留下的同伴。这里适合整理发现或休息。",
      "npcIds": [
        "innkeeper",
        "mela"
      ],
      "exits": [
        "market",
        "archive",
        "ferry",
        "shrine"
      ],
      "safeRest": true
    },
    {
      "id": "market",
      "title": "暖炉集市",
      "description": "面包摊重新点起了火，孩子围着廉价的发光石取暖。商人们称赞采石场的新泵，也有人悄悄收起带有议会印记的货票。货物、消息和帮手都可以在这里寻找。",
      "npcIds": [
        "broker"
      ],
      "exits": [
        "inn",
        "archive",
        "quarry",
        "council",
        "ferry"
      ],
      "safeRest": false
    },
    {
      "id": "archive",
      "title": "河务档案库",
      "description": "旧水线刻在档案柜的腿上。窗边晾着潮湿的账册，柜底传来缓慢的滴水声。管理员在保护文件与保护自己之间犹豫；通往庭院的水渠能容一只小桶通过。",
      "npcIds": [
        "archivist"
      ],
      "exits": [
        "inn",
        "market",
        "council",
        "observatory"
      ],
      "safeRest": false
    },
    {
      "id": "quarry",
      "title": "银脉采石场",
      "description": "一台新泵把银色微光从地下抽进镇上的暖炉管线。工人说这让冻病的人熬过了昨夜，也让岩壁后的水声越来越响。泵有检修闸门，旁边的石槽刻着旧引航灯的标志。一只被银光惊动的洞穴蜥蜴守在检修闸旁，时而撞击空桶；可以设法安抚、绕开，或在需要时迎战。",
      "npcIds": [
        "foreman"
      ],
      "exits": [
        "market",
        "ferry",
        "observatory"
      ],
      "safeRest": false
    },
    {
      "id": "ferry",
      "title": "失灯渡口",
      "description": "渡船停在河心的浅滩旁，乘客正举着白布招手。岸边有散木、系船绳和几只旧浮标。船长不愿带船撞上暗礁，却一直在寻找其他救人的办法。",
      "npcIds": [
        "captain"
      ],
      "exits": [
        "inn",
        "market",
        "quarry",
        "shrine"
      ],
      "safeRest": false
    },
    {
      "id": "observatory",
      "title": "山坡观测站",
      "description": "一面裂开的银镜对着河谷，刻度盘同时指向渡口与神龛。守站人把旧观测图压在工具箱底，害怕公开承认自己没弄懂镇灯的真正用途。这里有工作台，也有避雨的小屋。",
      "npcIds": [
        "astronomer"
      ],
      "exits": [
        "archive",
        "quarry",
        "shrine",
        "council"
      ],
      "safeRest": true
    },
    {
      "id": "shrine",
      "title": "无名者神龛",
      "description": "神像的面孔被水磨平了，石壁上却仍有三道通向河谷的细槽。守龛人记得旧祷词，也愿意听陌生人讲述自己的来历。名字与记忆在这里可以成为问题，尚未成为答案。",
      "npcIds": [
        "caretaker"
      ],
      "exits": [
        "inn",
        "ferry",
        "observatory",
        "council"
      ],
      "safeRest": true
    },
    {
      "id": "council",
      "title": "河谷议事厅",
      "description": "领事坐在长桌尽头，暖炉公会与渡口居民隔着一张空椅对视。所有人都知道镇灯出了问题，尚没人愿意先承担责任。你可以争取具体协助、提出调查问题；证据与已完成的行动将决定哪些最终方案能够兑现。",
      "npcIds": [
        "regent"
      ],
      "exits": [
        "market",
        "archive",
        "observatory",
        "shrine"
      ],
      "safeRest": false
    }
  ],
  "npcs": [
    {
      "id": "innkeeper",
      "name": "店主艾妲",
      "role": "照看旅人、熟悉旧镇歌的旅店主人",
      "want": "让这家店继续成为镇民能平安说话的地方，先照顾受惊的人。",
      "secret": "她保存的镇歌最后一段不是祈福，而是让三处镇灯重新同步的拍子；她一直以为那只是老人的迷信。",
      "location": "inn"
    },
    {
      "id": "mela",
      "name": "采石工梅拉",
      "role": "带着银粉与货运见闻逃进旅店的年轻工人",
      "want": "确认同伴平安，让自己的证词被认真听见，避免所有工人都被当成罪犯。",
      "secret": "她见过盖着议会印记的检修命令；她离开采石场后一直不敢说出工头的名字。",
      "location": "inn"
    },
    {
      "id": "broker",
      "name": "货商赛文",
      "role": "给暖炉公会送货、也认识渡口帮工的集市商人",
      "want": "保住生意与家人的取暖来源；在明确可行的计划下愿意协调帮手。",
      "secret": "最近的银镜碎片并非新采矿石，全部来自旧镇灯；他留下了对应货票。",
      "location": "market"
    },
    {
      "id": "archivist",
      "name": "管理员蕾娅",
      "role": "整理河务账册的谨慎文书",
      "want": "保护原始记录，让调查有可核对的证据，避免未经核实的指控。",
      "secret": "领事要求她把镇灯维护费记为新泵开支；她把原页藏进了遭水浸湿的旧账册。",
      "location": "archive"
    },
    {
      "id": "foreman",
      "name": "工头伯恩",
      "role": "知道泵站结构的暖炉公会工头",
      "want": "让工人不再挨冻、让病房暖炉继续工作；愿意停泵，但需要听见镇灯失效的实际证据。",
      "secret": "新泵借用了镇灯的银镜和地下通道。他察觉过水声异常，但相信议会批准过的检修命令。",
      "location": "quarry"
    },
    {
      "id": "captain",
      "name": "船长伊朔",
      "role": "熟悉暗礁与渡船乘客的老船长",
      "want": "先救出河心乘客；不愿为了显得勇敢而把更多人送进急流。",
      "secret": "旧浮标的铃声一直与观测站呼应。他昨夜听见铃声错开，担心河底发生了变化。",
      "location": "ferry"
    },
    {
      "id": "astronomer",
      "name": "守站人奥林",
      "role": "会修银镜、却对旧镇约了解有限的观测员",
      "want": "修复镇灯，并找到自己能够验证的办法；希望别人不要把所有旧知识的遗失都归罪于他。",
      "secret": "他发现神龛、观测站和渡口组成封印，但尚缺正确节拍；他没有把这项疑问写入巡检报告。",
      "location": "observatory"
    },
    {
      "id": "caretaker",
      "name": "守龛人素芙",
      "role": "记录名字、誓约与镇民记忆的守龛人",
      "want": "让旧誓约被理解，让来访者自己决定怎样解释身份；不愿以神迹之名制造未经证明的承诺。",
      "secret": "石壁缺损的旧名也出现在镇约上，那是见证人的名字；它是否属于来访者，需要更多证据，不能仅凭熟悉感认定。",
      "location": "shrine"
    },
    {
      "id": "regent",
      "name": "领事莉莎",
      "role": "负责月桥镇政务、批准新泵的地方领事",
      "want": "维持政权与镇民信任，避免失温和河难；不会仅凭恭维、威胁或身份宣称让出统治权。",
      "secret": "她批准了偷取镇灯材料的临时方案，并要求改写费用记录。她原以为能在春季补回材料，现在害怕承认判断失误。",
      "location": "council"
    }
  ],
  "clues": {
    "old-vow": {
      "title": "镇歌中的旧约",
      "text": "旧镇歌说，渡口铃、山镜与石龛应以同一节拍守望河底；镇灯既是引航设施，也是共同维护的封印。"
    },
    "cargo-route": {
      "title": "盖印的夜间货运",
      "text": "梅拉或后来赶来的工人证明，采石场的新泵用过旧镇灯的银镜。货物经过集市，随附议会批准的检修命令。"
    },
    "lens-pattern": {
      "title": "银镜碎片的去向",
      "text": "货票与碎片上的磨痕相互对应：从镇灯拆下的银镜被装进了新泵，并非来自新的矿脉。"
    },
    "evacuation-plan": {
      "title": "渡船救援计划",
      "text": "集市帮工与船长确认了浅滩、岸绳和接应位置。只要有人落实救援，乘客便有机会从河心撤回岸边。"
    },
    "ledger-proof": {
      "title": "未改写的维护账页",
      "text": "原始账页记录镇灯材料被转交新泵；修改稿把这笔费用写成了新采矿石。蕾娅保留了两页的对应日期和领事签记。"
    },
    "diversion-orders": {
      "title": "临时借用的批准命令",
      "text": "议会批准新泵借用镇灯材料，承诺春季归还。命令证明这不是工人私盗，也证明领事早已知道材料来自何处。"
    },
    "bypass-map": {
      "title": "泵站旁路示意",
      "text": "新泵的检修闸能把镇灯银镜与暖炉主管分开。直接砸泵会让病房失暖；关闭旁路可以先停止偷光，再安排替代热源。"
    },
    "siphon-idle": {
      "title": "新泵已停止偷光",
      "text": "银镜旁路已被关闭，封印不再持续失去月光。病房正使用旧炉，镇民仍需要商议长期取暖办法。"
    },
    "river-map": {
      "title": "浮标与三处守望点",
      "text": "浮标上的刻线与观测站、神龛形成三角。沿河水声与灯光的偏移能反推出山镜该恢复的角度。"
    },
    "bell-timing": {
      "title": "错开的铃声",
      "text": "渡口铃的回声落后了两个拍子。重新同步它与山镜、石龛，可以帮助恢复封印；大声呼喊本身不会产生神力。"
    },
    "seal-procedure": {
      "title": "可核对的修复步骤",
      "text": "先停止新泵偷光，再校准山镜与渡口节拍，最后让石龛刻槽重新接上微光。工匠与守龛人都能参与，不要求来访者拥有未记载的法术。"
    },
    "stable-light": {
      "title": "重新稳定的镇灯",
      "text": "山镜、渡口铃与石龛已重新同步，河底封印恢复稳定。暖炉与镇灯的长期分配问题仍需要公开处理。"
    },
    "ferry-evacuated": {
      "title": "乘客已回到岸上",
      "text": "河心乘客已经撤回岸边，船长核对过人数。渡船设施是否能立即恢复运营是另一件事，不能由救援成功自动推断。"
    },
    "true-name-fragment": {
      "title": "石壁上缺损的旧名",
      "text": "神龛与镇约上留有同一个缺损名字。它可能与来访者的记忆、师承或信仰有关，但现有证据没有证明任何人就是神，也没有赋予神力。"
    }
  },
  "objectives": {
    "witness-safe": {
      "title": "让证人敢于开口",
      "description": "梅拉确认自己的证言被认真保留，工人的处境也被听见。"
    },
    "supply-traced": {
      "title": "查明银镜来源",
      "description": "把旧镇灯的材料与新泵货运对应起来。"
    },
    "rescue-prepared": {
      "title": "组织渡船接应",
      "description": "协调能够在岸边落实的救援计划。"
    },
    "proof-secured": {
      "title": "保存改账证据",
      "description": "取得可公开核对的原始账页与修改稿。"
    },
    "conspiracy-mapped": {
      "title": "查清批准经过",
      "description": "区分议会批准、公会执行与普通工人的责任。"
    },
    "siphon-located": {
      "title": "找到偷光旁路",
      "description": "看懂泵站如何分走封印的月光。"
    },
    "siphon-stopped": {
      "title": "停止偷取月光",
      "description": "关闭银镜旁路，使封印不再持续失光。"
    },
    "residents-safe": {
      "title": "救回河心居民",
      "description": "让渡船乘客真实回到岸上，而非仅提出计划。"
    },
    "threat-mapped": {
      "title": "理解河底危机",
      "description": "确认渡口、山镜和石龛共同守着河底封印。"
    },
    "seal-understood": {
      "title": "找到修复方法",
      "description": "取得工匠能够核对并执行的修复步骤。"
    },
    "seal-repaired": {
      "title": "恢复河底封印",
      "description": "实际同步三处守望点，让镇灯恢复稳定。"
    },
    "history-recovered": {
      "title": "留下身份线索",
      "description": "记录旧名与记忆的联系，保留尚未解决的问题。"
    }
  },
  "opportunities": [
    {
      "id": "hear-old-song",
      "location": "inn",
      "title": "从镇歌寻找旧约",
      "prompt": "通过询问店主、复原漏掉的词句、研究歌谣或其他合理办法，弄清镇歌与河灯的关系。",
      "skills": [
        "investigation",
        "insight",
        "persuasion",
        "arcana"
      ],
      "dc": 10,
      "requires": [],
      "success": {
        "text": "艾妲唱出了被省略的最后一段。你记录下三处守望点应当共享同一节拍的旧约。",
        "clues": [
          "old-vow"
        ],
        "objectives": [],
        "trustNpc": "innkeeper"
      },
      "failure": {
        "text": "旧歌的意思仍没能确定，炉边的人继续争论。你花了时间，可以去神龛核对刻文，或寻找别的证据。",
        "clock": 1
      }
    },
    {
      "id": "hear-mela",
      "location": "inn",
      "title": "让受惊的工人讲清见闻",
      "prompt": "安抚梅拉、耐心核对货运经历，或用能建立信任的方式记录她亲眼看见的事；不要替她编造证词。",
      "skills": [
        "insight",
        "persuasion",
        "investigation"
      ],
      "dc": 10,
      "requires": [],
      "success": {
        "text": "梅拉愿意留下证言，并说明银镜货物与议会检修命令的关系。你也记下了她对同伴的担忧。",
        "clues": [
          "cargo-route"
        ],
        "objectives": [
          "witness-safe"
        ],
        "trustNpc": "mela"
      },
      "failure": {
        "text": "梅拉仍不敢把见闻说完整。你没有取得证词，追问耗费了时间；集市的货票也可能指向同一批材料。",
        "clock": 1
      }
    },
    {
      "id": "trace-market-cargo",
      "location": "market",
      "title": "追查发光石与银镜货票",
      "prompt": "核对磨痕、观察摊贩交接、谈妥查看货票，或提出其他能真实确认材料来源的方法。",
      "skills": [
        "investigation",
        "perception",
        "persuasion",
        "stealth"
      ],
      "dc": 12,
      "requires": [],
      "success": {
        "text": "你把碎片磨痕与货票对应起来，确认新泵使用了从旧镇灯拆下的银镜。",
        "clues": [
          "lens-pattern"
        ],
        "objectives": [